{
  "schema": "stoner.production-device-class-registry",
  "schemaVersion": 1,
  "registryVersion": 1,
  "classes": [
    {
      "deviceClass": "linux.software-vulkan.rgba8",
      "capabilitySignature": {
        "registryVersion": 1,
        "backendImplementation": "lavapipe",
        "cpuArchitecture": "x86_64",
        "adapterFamily": "software-vulkan",
        "shaderProfile": "vulkan-1.3",
        "colorFormat": "rgba8-unorm",
        "depthFormat": "d32-float",
        "sampleCount": 1,
        "textureFormatFamily": "portable-ktx2"
      }
    },
    {
      "deviceClass": "macos.apple8.metal.rgba8",
      "capabilitySignature": {
        "registryVersion": 1,
        "backendImplementation": "native-metal",
        "cpuArchitecture": "arm64",
        "adapterFamily": "apple8",
        "shaderProfile": "metal-macos-12-arm64",
        "colorFormat": "rgba8-unorm",
        "depthFormat": "d32-float",
        "sampleCount": 1,
        "textureFormatFamily": "astc"
      }
    },
    {
      "deviceClass": "macos.apple8.moltenvk.rgba8",
      "capabilitySignature": {
        "registryVersion": 1,
        "backendImplementation": "moltenvk",
        "cpuArchitecture": "arm64",
        "adapterFamily": "apple8",
        "shaderProfile": "vulkan-1.3",
        "colorFormat": "rgba8-unorm",
        "depthFormat": "d32-float",
        "sampleCount": 1,
        "textureFormatFamily": "astc"
      }
    },
    {
      "deviceClass": "macos.intel.metal.rgba8",
      "capabilitySignature": {
        "registryVersion": 1,
        "backendImplementation": "native-metal",
        "cpuArchitecture": "x86_64",
        "adapterFamily": "intel-mac",
        "shaderProfile": "metal-macos-12-x86_64",
        "colorFormat": "rgba8-unorm",
        "depthFormat": "d32-float",
        "sampleCount": 1,
        "textureFormatFamily": "bc"
      }
    },
    {
      "deviceClass": "windows.discrete-vulkan.rgba8",
      "capabilitySignature": {
        "registryVersion": 1,
        "backendImplementation": "native-vulkan",
        "cpuArchitecture": "x86_64",
        "adapterFamily": "discrete-vulkan",
        "shaderProfile": "vulkan-1.3",
        "colorFormat": "rgba8-unorm",
        "depthFormat": "d32-float",
        "sampleCount": 1,
        "textureFormatFamily": "bc"
      }
    }
  ]
}
